{"version":1,"generator":"xf-typegen-standalone 0.1.0","generatedAt":"2026-06-25T15:17:41+00:00","xf":{"versionId":2021370,"version":"2.2.13","branch":"2.2"},"activeAddOns":["XF"],"classExtensions":[{"proxy":"Vendor\\AddOn\\XF\\Repository\\XFCP_User","extends":"XF\\Repository\\User"}],"services":{"XF:User\\Registration":"XF\\Service\\User\\Registration"},"captchas":{"XF:Turnstile":"XF\\Captcha\\Turnstile"},"options":{"boardTitle":"string","maxAttachmentSize":"int","boardActive":"bool"},"entities":{"XF:ActivitySummaryDefinition":{"shortName":"XF:ActivitySummaryDefinition","class":"XF\\Entity\\ActivitySummaryDefinition","table":"xf_activity_summary_definition","primaryKey":["definition_id"],"finder":null,"repository":null,"columns":{"definition_id":{"phpType":"string","nullable":false,"xfType":"str","primary":true},"definition_class":{"phpType":"string","nullable":false,"xfType":"str"},"addon_id":{"phpType":"string","nullable":false,"xfType":"binary"}},"relations":{"AddOn":{"to":"one","entity":"XF:AddOn","class":"XF\\Entity\\AddOn"},"MasterTitle":{"to":"one","entity":"XF:Phrase","class":"XF\\Entity\\Phrase"},"MasterDescription":{"to":"one","entity":"XF:Phrase","class":"XF\\Entity\\Phrase"}},"getters":{}},"XF:ActivitySummarySection":{"shortName":"XF:ActivitySummarySection","class":"XF\\Entity\\ActivitySummarySection","table":"xf_activity_summary_section","primaryKey":["section_id"],"finder":"XF\\Finder\\ActivitySummarySection","repository":null,"columns":{"section_id":{"phpType":"int","nullable":true,"xfType":"uint","primary":true},"definition_id":{"phpType":"string","nullable":false,"xfType":"str"},"display_order":{"phpType":"int","nullable":false,"xfType":"uint"},"show_value":{"phpType":"bool","nullable":false,"xfType":"bool"},"options":{"phpType":"array","nullable":false,"xfType":"json_array"},"active":{"phpType":"bool","nullable":false,"xfType":"bool"}},"relations":{"MasterTitle":{"to":"one","entity":"XF:Phrase","class":"XF\\Entity\\Phrase"},"ActivitySummaryDefinition":{"to":"one","entity":"XF:ActivitySummaryDefinition","class":"XF\\Entity\\ActivitySummaryDefinition"}},"getters":{"handler":{"phpType":"\\XF\\ActivitySummary\\AbstractSection|null","nullable":true,"source":"phpdoc"}}},"XF:AddOn":{"shortName":"XF:AddOn","class":"XF\\Entity\\AddOn","table":"xf_addon","primaryKey":["addon_id"],"finder":null,"repository":"XF\\Repository\\AddOn","columns":{"addon_id":{"phpType":"string","nullable":false,"xfType":"binary","primary":true},"title":{"phpType":"string","nullable":false,"xfType":"str"},"version_string":{"phpType":"string","nullable":false,"xfType":"str"},"version_id":{"phpType":"int","nullable":false,"xfType":"uint"},"json_hash":{"phpType":"string","nullable":false,"xfType":"str"},"active":{"phpType":"bool","nullable":false,"xfType":"bool"},"is_legacy":{"phpType":"bool","nullable":false,"xfType":"bool"},"is_processing":{"phpType":"bool","nullable":false,"xfType":"bool"},"last_pending_action":{"phpType":"string","nullable":true,"xfType":"str"}},"relations":{},"getters":{"addon_id_url":{"phpType":"string","nullable":false,"source":"phpdoc"}}},"XF:AddOnInstallBatch":{"shortName":"XF:AddOnInstallBatch","class":"XF\\Entity\\AddOnInstallBatch","table":"xf_addon_install_batch","primaryKey":["batch_id"],"finder":null,"repository":null,"columns":{"batch_id":{"phpType":"int","nullable":true,"xfType":"uint","primary":true},"start_date":{"phpType":"int","nullable":false,"xfType":"uint"},"complete_date":{"phpType":"int","nullable":false,"xfType":"uint"},"addon_ids":{"phpType":"array","nullable":false,"xfType":"json_array"},"results":{"phpType":"array","nullable":false,"xfType":"json_array"}},"relations":{},"getters":{}},"XF:Admin":{"shortName":"XF:Admin","class":"XF\\Entity\\Admin","table":"xf_admin","primaryKey":["user_id"],"finder":null,"repository":"XF\\Repository\\Admin","columns":{"user_id":{"phpType":"int","nullable":false,"xfType":"uint","primary":true},"extra_user_group_ids":{"phpType":"array","nullable":false,"xfType":"list_comma"},"last_login":{"phpType":"int","nullable":false,"xfType":"uint"},"permission_cache":{"phpType":"array","nullable":false,"xfType":"json_array"},"admin_language_id":{"phpType":"int","nullable":false,"xfType":"uint"},"advanced":{"phpType":"bool","nullable":false,"xfType":"bool"},"is_super_admin":{"phpType":"bool","nullable":false,"xfType":"bool"}},"relations":{"User":{"to":"one","entity":"XF:User","class":"XF\\Entity\\User"}},"getters":{"username":{"phpType":"string","nullable":false,"source":"phpdoc"}}},"XF:AdminLog":{"shortName":"XF:AdminLog","class":"XF\\Entity\\AdminLog","table":"xf_admin_log","primaryKey":["admin_log_id"],"finder":null,"repository":"XF\\Repository\\AdminLog","columns":{"admin_log_id":{"phpType":"int","nullable":true,"xfType":"uint","primary":true},"user_id":{"phpType":"int","nullable":false,"xfType":"uint"},"request_date":{"phpType":"int","nullable":false,"xfType":"uint"},"request_url":{"phpType":"string","nullable":false,"xfType":"str"},"request_data":{"phpType":"array","nullable":false,"xfType":"json_array"},"ip_address":{"phpType":"string","nullable":false,"xfType":"binary"}},"relations":{"User":{"to":"one","entity":"XF:User","class":"XF\\Entity\\User"}},"getters":{"request_url":{"phpType":"string","nullable":false,"source":"phpdoc"},"request_url_short":{"phpType":"string","nullable":false,"source":"phpdoc"}}},"XF:AdminNavigation":{"shortName":"XF:AdminNavigation","class":"XF\\Entity\\AdminNavigation","table":"xf_admin_navigation","primaryKey":["navigation_id"],"finder":null,"repository":"XF\\Repository\\AdminNavigation","columns":{"navigation_id":{"phpType":"string","nullable":false,"xfType":"str","primary":true},"parent_navigation_id":{"phpType":"string","nullable":false,"xfType":"str"},"display_order":{"phpType":"int","nullable":false,"xfType":"uint"},"link":{"phpType":"string","nullable":false,"xfType":"str"},"icon":{"phpType":"string","nullable":false,"xfType":"str"},"admin_permission_id":{"phpType":"string","nullable":false,"xfType":"str"},"debug_only":{"phpType":"bool","nullable":false,"xfType":"bool"},"development_only":{"phpType":"bool","nullable":false,"xfType":"bool"},"hide_no_children":{"phpType":"bool","nullable":false,"xfType":"bool"},"addon_id":{"phpType":"string","nullable":false,"xfType":"binary"}},"relations":{"AddOn":{"to":"one","entity":"XF:AddOn","class":"XF\\Entity\\AddOn"},"Parent":{"to":"one","entity":"XF:AdminNavigation","class":"XF\\Entity\\AdminNavigation"},"Children":{"to":"many","entity":"XF:AdminNavigation","class":"XF\\Entity\\AdminNavigation"},"MasterTitle":{"to":"one","entity":"XF:Phrase","class":"XF\\Entity\\Phrase"}},"getters":{"title":{"phpType":"\\XF\\Phrase","nullable":false,"source":"phpdoc"}}},"XF:AdminPermission":{"shortName":"XF:AdminPermission","class":"XF\\Entity\\AdminPermission","table":"xf_admin_permission","primaryKey":["admin_permission_id"],"finder":null,"repository":"XF\\Repository\\AdminPermission","columns":{"admin_permission_id":{"phpType":"string","nullable":false,"xfType":"str","primary":true},"display_order":{"phpType":"int","nullable":false,"xfType":"uint"},"addon_id":{"phpType":"string","nullable":false,"xfType":"binary"}},"relations":{"AddOn":{"to":"one","entity":"XF:AddOn","class":"XF\\Entity\\AddOn"},"MasterTitle":{"to":"one","entity":"XF:Phrase","class":"XF\\Entity\\Phrase"}},"getters":{"title":{"phpType":"\\XF\\Phrase","nullable":false,"source":"phpdoc"}}},"XF:Advertising":{"shortName":"XF:Advertising","class":"XF\\Entity\\Advertising","table":"xf_advertising","primaryKey":["ad_id"],"finder":null,"repository":"XF\\Repository\\Advertising","columns":{"ad_id":{"phpType":"int","nullable":true,"xfType":"uint","primary":true},"title":{"phpType":"string","nullable":false,"xfType":"str"},"position_id":{"phpType":"string","nullable":false,"xfType":"str"},"ad_html":{"phpType":"string","nullable":false,"xfType":"str"},"display_criteria":{"phpType":"array","nullable":false,"xfType":"json_array"},"display_order":{"phpType":"int","nullable":false,"xfType":"uint"},"active":{"phpType":"bool","nullable":false,"xfType":"bool"}},"relations":{"AdvertisingPosition":{"to":"one","entity":"XF:AdvertisingPosition","class":"XF\\Entity\\AdvertisingPosition"}},"getters":{}},"XF:AdvertisingPosition":{"shortName":"XF:AdvertisingPosition","class":"XF\\Entity\\AdvertisingPosition","table":"xf_advertising_position","primaryKey":["position_id"],"finder":null,"repository":null,"columns":{"position_id":{"phpType":"string","nullable":false,"xfType":"str","primary":true},"arguments":{"phpType":"array","nullable":false,"xfType":"json_array"},"addon_id":{"phpType":"string","nullable":false,"xfType":"binary"},"active":{"phpType":"bool","nullable":false,"xfType":"bool"}},"relations":{"AddOn":{"to":"one","entity":"XF:AddOn","class":"XF\\Entity\\AddOn"},"MasterTitle":{"to":"one","entity":"XF:Phrase","class":"XF\\Entity\\Phrase"},"MasterDescription":{"to":"one","entity":"XF:Phrase","class":"XF\\Entity\\Phrase"}},"getters":{"title":{"phpType":"\\XF\\Phrase","nullable":false,"source":"phpdoc"},"description":{"phpType":"\\XF\\Phrase","nullable":false,"source":"phpdoc"}}},"XF:ApiAttachmentKey":{"shortName":"XF:ApiAttachmentKey","class":"XF\\Entity\\ApiAttachmentKey","table":"xf_api_attachment_key","primaryKey":["attachment_key"],"finder":null,"repository":null,"columns":{"attachment_key":{"phpType":"string","nullable":false,"xfType":"str","primary":true},"create_date":{"phpType":"int","nullable":false,"xfType":"uint"},"user_id":{"phpType":"int","nullable":false,"xfType":"uint"},"temp_hash":{"phpType":"string","nullable":false,"xfType":"str"},"content_type":{"phpType":"string","nullable":false,"xfType":"str"},"context":{"phpType":"array","nullable":false,"xfType":"json_array"}},"relations":{},"getters":{}},"XF:ApiKey":{"shortName":"XF:ApiKey","class":"XF\\Entity\\ApiKey","table":"xf_api_key","primaryKey":["api_key_id"],"finder":null,"repository":null,"columns":{"api_key_id":{"phpType":"int","nullable":true,"xfType":"uint","primary":true},"api_key